<?xml version="1.0" encoding="UTF-8" standalone="no"?>
<!DOCTYPE path SYSTEM "result.dtd">
<path cost="149" nbMovies="3">
<actor>Macaulay Culkin</actor>
<movie name="My Girl" year="1991"/>
<actor>Jody Wilson(I)</actor>
<movie name="Big Trouble" year="2002"/>
<actor>Lars Arentz-Hansen</actor>
<movie name="Beach, The" year="2000"/>
<actor>Guillaume Canet</actor>
</path>
