<?xml version="1.0" encoding="UTF-8" standalone="no"?>
<!DOCTYPE path SYSTEM "result.dtd">
<path cost="247" nbMovies="3">
	<actor>Macaulay Culkin</actor>
	<movie name="Good Son, The" year="1993">Good Son, The</movie>
	<actor>Gerry Becker</actor>
	<movie name="Cell, The" year="2000">Cell, The</movie>
	<actor>Leonardo DiCaprio</actor>
	<movie name="Celebrity" year="1998">Celebrity</movie>
	<actor>Guillaume Canet</actor>
</path>
