<?xml version="1.0" encoding="UTF-8" standalone="no"?>
<!DOCTYPE path SYSTEM "result.dtd">
<path cost="91" nbMovies="4">
<actor>Macaulay Culkin</actor>
<movie name="Good Son, The" year="1993">Good Son, The</movie>
<actor>Elijah Wood</actor>
<movie name="Eternal Sunshine of the Spotless Mind" year="2004">Eternal Sunshine of the Spotless Mind</movie>
<actor>Tom Wilkinson(I)</actor>
<movie name="Ghost and the Darkness, The" year="1996">Ghost and the Darkness, The</movie>
<actor>Alex Ferns</actor>
<movie name="Joyeux Noël" year="2005">Joyeux Noël</movie>
<actor>Guillaume Canet</actor>
</path>
